{
  "version": "0.1",
  "message_id": "11111111-1111-1111-1111-111111111117",
  "task_id": "aaaaaaaa-aaaa-aaaa-aaaa-aaaaaaaaaaaa",
  "type": "ReviewComment",
  "timestamp": "2025-01-01T00:00:00Z",
  "sender": {
    "agent_id": "22222222-2222-2222-2222-222222222222",
    "role": "reviewer",
    "capabilities": ["review"]
  },
  "payload": {
    "file": "hub/app.py",
    "line": 1,
    "comment": "Consider adding a docstring",
    "ref_diff_id": "44444444-4444-4444-4444-444444444444"
  }
}

