{
  "version": "0.1",
  "message_id": "11111111-1111-1111-1111-111111111116",
  "task_id": "aaaaaaaa-aaaa-aaaa-aaaa-aaaaaaaaaaaa",
  "type": "TestResult",
  "timestamp": "2025-01-01T00:00:00Z",
  "sender": {
    "agent_id": "22222222-2222-2222-2222-222222222222",
    "role": "test-runner",
    "capabilities": ["test"]
  },
  "payload": {
    "runner": "pytest",
    "cases": ["tests/test_example.py::test_ok"],
    "passed": 1,
    "failed": 0,
    "logs": "All good"
  }
}

