{
  "version": "0.1",
  "message_id": "11111111-1111-1111-1111-111111111111",
  "task_id": "aaaaaaaa-aaaa-aaaa-aaaa-aaaaaaaaaaaa",
  "type": "Plan",
  "timestamp": "2025-01-01T00:00:00Z",
  "sender": {
    "agent_id": "22222222-2222-2222-2222-222222222222",
    "role": "planner",
    "capabilities": ["plan"]
  },
  "payload": {
    "dag": {
      "nodes": [{"id": "A", "label": "Start"}, {"id": "B", "label": "End"}],
      "edges": [{"source": "A", "target": "B"}]
    },
    "owners": [{"role": "coder", "files": ["hub/app.py"]}]
  }
}

