{
  "version": "0.1",
  "message_id": "11111111-1111-1111-1111-111111111118",
  "task_id": "aaaaaaaa-aaaa-aaaa-aaaa-aaaaaaaaaaaa",
  "type": "ConflictDetected",
  "timestamp": "2025-01-01T00:00:00Z",
  "sender": {
    "agent_id": "22222222-2222-2222-2222-222222222222",
    "role": "hub",
    "capabilities": ["merge", "conflict"]
  },
  "payload": {
    "file": "service.py",
    "base_rev": 3,
    "hunks": [
      {
        "range": {"start_line": 10, "end_line": 14},
        "ours": "- print('a')\n+ print('b')\n",
        "theirs": "- print('a')\n+ print('c')\n",
        "reason": "overlapping changes"
      }
    ]
  }
}

