{
  "version": "0.1",
  "message_id": "11111111-1111-1111-1111-111111111113",
  "type": "ContentionMetrics",
  "timestamp": "2025-01-01T00:00:00Z",
  "sender": {
    "agent_id": "22222222-2222-2222-2222-222222222223",
    "role": "observability",
    "capabilities": ["metrics"]
  },
  "payload": {
    "interval_sec": 5.0,
    "totals": {"files": 1, "holders": 1, "queued": 2},
    "files": [
      {"file": "hub/app.py", "holders": 1, "queued": 2}
    ]
  }
}

